{
  "contract_version": 1,
  "plan": {
    "contract_version": 1,
    "models": [
      {
        "model": "order-lifecycle",
        "model_hash": "sha256:8d9f1f8a86f4c04fae5fd8c9f07259005c247caf0fe19e2f119c56d6cb507d1b",
        "undeclared_event_policy": "error",
        "shim_registered": false,
        "verified_by": [
          "RU-0002",
          "RU-0006"
        ],
        "checks": [
          {
            "kind": "transition",
            "id": "transition_cancelling_on_refund_settled_to_cancelled",
            "from": "cancelling",
            "event": "REFUND_SETTLED",
            "to": "cancelled"
          },
          {
            "kind": "transition",
            "id": "transition_placed_on_cancel_to_cancelling",
            "from": "placed",
            "event": "CANCEL",
            "to": "cancelling"
          },
          {
            "kind": "transition",
            "id": "transition_placed_on_ship_to_shipped",
            "from": "placed",
            "event": "SHIP",
            "to": "shipped"
          },
          {
            "kind": "rejection",
            "id": "rejects_cancelled_on_cancel",
            "state": "cancelled",
            "event": "CANCEL",
            "expect": "error"
          },
          {
            "kind": "rejection",
            "id": "rejects_cancelled_on_refund_settled",
            "state": "cancelled",
            "event": "REFUND_SETTLED",
            "expect": "error"
          },
          {
            "kind": "rejection",
            "id": "rejects_cancelled_on_ship",
            "state": "cancelled",
            "event": "SHIP",
            "expect": "error"
          },
          {
            "kind": "rejection",
            "id": "rejects_cancelling_on_cancel",
            "state": "cancelling",
            "event": "CANCEL",
            "expect": "error"
          },
          {
            "kind": "rejection",
            "id": "rejects_cancelling_on_ship",
            "state": "cancelling",
            "event": "SHIP",
            "expect": "error"
          },
          {
            "kind": "rejection",
            "id": "rejects_placed_on_refund_settled",
            "state": "placed",
            "event": "REFUND_SETTLED",
            "expect": "error"
          },
          {
            "kind": "rejection",
            "id": "rejects_shipped_on_cancel",
            "state": "shipped",
            "event": "CANCEL",
            "expect": "error"
          },
          {
            "kind": "rejection",
            "id": "rejects_shipped_on_refund_settled",
            "state": "shipped",
            "event": "REFUND_SETTLED",
            "expect": "error"
          },
          {
            "kind": "rejection",
            "id": "rejects_shipped_on_ship",
            "state": "shipped",
            "event": "SHIP",
            "expect": "error"
          },
          {
            "kind": "invariant",
            "id": "invariant_no_new_picks_dispatched",
            "state": "cancelling",
            "name": "no_new_picks_dispatched"
          }
        ]
      }
    ]
  },
  "constants": {
    "shared": {
      "manifest_hash": "sha256:277e80d1c2d187da40bf7df676239e2ec8656a4f699c35a12138d5ad94fab4de",
      "values": {
        "retention.audit_days": 90,
        "fulfilment.halt_seconds": 5
      }
    }
  },
  "options": {
    "trace_scan": [
      "**/Cargo.toml"
    ],
    "conformance_crate": "spec-conformance-tests",
    "service": "service-orders"
  }
}
